{
  "$ref": "#/definitions/projects",
  "definitions": {
    "projects": {
      "type": "object",
      "properties": {
        "slug": {
          "type": "string"
        },
        "image": {
          "type": "string"
        },
        "badge": {
          "type": "string"
        },
        "badgeColor": {
          "type": "string"
        },
        "title": {
          "type": "string"
        },
        "subtitle": {
          "type": "string"
        },
        "description": {
          "type": "string"
        },
        "fullDescription": {
          "type": "string"
        },
        "scope": {
          "type": "array",
          "items": {
            "type": "string"
          }
        },
        "client": {
          "type": "string"
        },
        "location": {
          "type": "string"
        },
        "year": {
          "type": "string"
        },
        "category": {
          "type": "string"
        },
        "$schema": {
          "type": "string"
        }
      },
      "required": [
        "slug",
        "image",
        "badge",
        "badgeColor",
        "title",
        "subtitle",
        "description",
        "fullDescription",
        "scope",
        "client",
        "location",
        "year",
        "category"
      ],
      "additionalProperties": false
    }
  },
  "$schema": "http://json-schema.org/draft-07/schema#"
}