{
  "slug": "panbil-industrial-park",
  "image": "/images/projects/wwtp-panbil-industrial-park-1.png",
  "badge": "WTP",
  "badgeColor": "bg-green-600",
  "title": "Panbil Industrial Park",
  "subtitle": "WTP Expansion",
  "description": "Capacity expansion project utilizing MBR & MBBR systems for industrial wastewater management.",
  "fullDescription": "PT Toolmate Technologies Indonesia successfully completed the WTP (Waste Treatment Plant) expansion project at Panbil Industrial Park. This project involved upgrading the existing facility to handle increased industrial wastewater capacity from the growing number of tenants in the industrial estate.",
  "scope": [
    "Design and engineering of expanded WTP capacity",
    "Installation of MBR (Membrane Bioreactor) systems",
    "Implementation of MBBR (Moving Bed Biofilm Reactor) technology",
    "Piping and civil works for new treatment tanks",
    "Commissioning and performance testing"
  ],
  "client": "Panbil Industrial Park",
  "location": "Batam, Indonesia",
  "year": "2022",
  "category": "wtp"
}
