{
  "slug": "wwtp-panbil-industrial-park",
  "image": "/images/projects/wwtp-panbil-industrial-park-1.png",
  "badge": "WWTP",
  "badgeColor": "bg-green-600",
  "title": "WWTP Panbil",
  "subtitle": "Proyek Kapasitas Process",
  "description": "Waste Water Treatment Plant capacity process project at Muka Kuning industrial area.",
  "fullDescription": "PT Toolmate Technologies Indonesia completed a WWTP capacity process project at Panbil, Muka Kuning - Batam. The project involved construction and installation of wastewater treatment infrastructure including underground piping systems, treatment tanks, and processing equipment for industrial wastewater management.",
  "scope": [
    "Treatment tank construction",
    "Underground piping installation",
    "Pump and valve systems",
    "Civil works and earthworks",
    "System commissioning"
  ],
  "client": "WWTP Panbil",
  "location": "Muka Kuning, Batam, Indonesia",
  "year": "2022",
  "category": "wwtp"
}
