{
  "slug": "vmc-finishing-tackle",
  "image": "/images/projects/vmc-finishing-tackle.jpg",
  "badge": "M&E",
  "badgeColor": "bg-purple-600",
  "title": "PT. VMC Finishing Tackle Indonesia",
  "subtitle": "M & E and Renovation Works",
  "description": "Mechanical & Electrical installation combined with factory renovation works.",
  "fullDescription": "PT Toolmate Technologies Indonesia executed a comprehensive M&E and renovation project for PT. VMC Finishing Tackle Indonesia. The scope included mechanical piping systems, electrical installations, and factory space renovation to improve production efficiency and facility standards.",
  "scope": [
    "Mechanical piping installation",
    "Electrical panel and wiring works",
    "Factory space renovation",
    "Equipment installation support",
    "System integration and testing"
  ],
  "client": "PT. VMC Finishing Tackle Indonesia",
  "location": "Batam, Indonesia",
  "year": "2022",
  "category": "mne"
}
